{
  "authority": {
    "core_claim_authority": "none",
    "publication_authority": "none",
    "release_authority": "none",
    "scientific_validation_authority": "none",
    "scope": "repository_admission_and_byte_identity_only",
    "supersedes_predecessor": false
  },
  "base_identity": {
    "commit": "f8b32ef0af9cb6804f256490b4daafbdba43740e",
    "relationship": "audited_repository_base",
    "tree": "251895700cdfc80addf180d46178b5aa8c43528c"
  },
  "change_roster": {
    "expected_paths": [
      "LICENSE_MAP.md",
      "MANIFEST.sha256",
      "README.md",
      "evidence/README.md",
      "evidence/dark_medium_response_atlas_successor_overlay_s1.json",
      "resources/README.md",
      "resources/dark-medium-response-atlas/draft-v0.1.0/CHANGE_LOG.md",
      "resources/dark-medium-response-atlas/draft-v0.1.0/DARK_MEDIUM_RESPONSE_ATLAS.md",
      "resources/dark-medium-response-atlas/draft-v0.1.0/LICENSE_MAP.md",
      "resources/dark-medium-response-atlas/draft-v0.1.0/README.md",
      "resources/dark-medium-response-atlas/draft-v0.1.0/claim_ledger.csv",
      "resources/dark-medium-response-atlas/draft-v0.1.0/draft_metadata.json",
      "resources/dark-medium-response-atlas/draft-v0.1.0/novelty_ledger.csv",
      "resources/dark-medium-response-atlas/draft-v0.1.0/source_ledger.csv",
      "schemas/README.md",
      "schemas/dark-medium-response-atlas-successor-overlay-s1.schema.json",
      "tests/test_claim_source_coverage.py",
      "tests/test_dark_medium_response_atlas_successor_overlay.py",
      "tools/build_dark_medium_response_atlas_successor_overlay.py",
      "tools/check_repository.py",
      "tools/verify.py"
    ],
    "identity_closure_paths": [
      "MANIFEST.sha256",
      "evidence/dark_medium_response_atlas_successor_overlay_s1.json"
    ],
    "source_paths": [
      "LICENSE_MAP.md",
      "README.md",
      "evidence/README.md",
      "resources/README.md",
      "resources/dark-medium-response-atlas/draft-v0.1.0/CHANGE_LOG.md",
      "resources/dark-medium-response-atlas/draft-v0.1.0/DARK_MEDIUM_RESPONSE_ATLAS.md",
      "resources/dark-medium-response-atlas/draft-v0.1.0/LICENSE_MAP.md",
      "resources/dark-medium-response-atlas/draft-v0.1.0/README.md",
      "resources/dark-medium-response-atlas/draft-v0.1.0/claim_ledger.csv",
      "resources/dark-medium-response-atlas/draft-v0.1.0/draft_metadata.json",
      "resources/dark-medium-response-atlas/draft-v0.1.0/novelty_ledger.csv",
      "resources/dark-medium-response-atlas/draft-v0.1.0/source_ledger.csv",
      "schemas/README.md",
      "schemas/dark-medium-response-atlas-successor-overlay-s1.schema.json",
      "tests/test_claim_source_coverage.py",
      "tests/test_dark_medium_response_atlas_successor_overlay.py",
      "tools/build_dark_medium_response_atlas_successor_overlay.py",
      "tools/check_repository.py",
      "tools/verify.py"
    ]
  },
  "generator": {
    "dependency_lock_path": "requirements-lock.txt",
    "dependency_lock_sha256": "69b83ca86466525e912ea7c2d4a614d426ab44411ccc2789febc32f54c255721",
    "environment_note": "ENVIRONMENT_LIMITED: generated with python==3.12.13; release-authoritative regeneration requires python==3.12.10.",
    "output_path": "evidence/dark_medium_response_atlas_successor_overlay_s1.json",
    "path": "tools/build_dark_medium_response_atlas_successor_overlay.py",
    "permitted_environment_limited_runtime": "python==3.12.13",
    "required_runtime": "python==3.12.10",
    "runtime": "python==3.12.13",
    "runtime_classification": "environment_limited",
    "runtime_classification_scope": "cpython-version-and-repository-runtime-contract-bytes",
    "runtime_contract_path": "RUNTIME.json",
    "runtime_contract_sha256": "f3fa00ed692fc6738b47f6c8a44e9c5ac062d269ac452cfbcf90c4ef8ff39485",
    "runtime_implementation": "CPython",
    "schema_path": "schemas/dark-medium-response-atlas-successor-overlay-s1.schema.json",
    "schema_sha256": "4a4433b83a62dfd18ea65b761372888a1ab67e5dac1ec8b5386edcb7d9e4e76d",
    "version": "1.0.0"
  },
  "overlay_id": "dark-medium-response-atlas-successor-s1",
  "overlay_kind": "supplemental_resource_admission",
  "package": {
    "aggregate": {
      "canonical_byte_domain": "git-index-blob",
      "canonical_bytes": 1059,
      "digest_algorithm": "sha256",
      "scheme": "astra-package-roster-v1",
      "scope": "astra-dark-medium-response-atlas-draft-v0.1.0-package-v1",
      "serialization": "astra-binary-length-prefixed-v1",
      "sha256": "5993bcf52c786a1b48f05e303228b99ae5e7f22fd879058efd2af12b754abaf5"
    },
    "file_count": 8,
    "files": [
      {
        "bytes": 877,
        "mode": "100644",
        "path": "resources/dark-medium-response-atlas/draft-v0.1.0/CHANGE_LOG.md",
        "sha256": "f611d597894ec08f6f6614ef662a32d584097385a3a8c314e17d5ec95c5c6a35"
      },
      {
        "bytes": 55275,
        "mode": "100644",
        "path": "resources/dark-medium-response-atlas/draft-v0.1.0/DARK_MEDIUM_RESPONSE_ATLAS.md",
        "sha256": "d133dfd20d1d1ecd0a620b27f4fb99a85f7a864cfd07f3c16cb2d45543801205"
      },
      {
        "bytes": 942,
        "mode": "100644",
        "path": "resources/dark-medium-response-atlas/draft-v0.1.0/LICENSE_MAP.md",
        "sha256": "500a7f0492103776f6f12a4f45a21b1b6abbd46df2f5ddcb66ebb81051fcf090"
      },
      {
        "bytes": 4163,
        "mode": "100644",
        "path": "resources/dark-medium-response-atlas/draft-v0.1.0/README.md",
        "sha256": "0e7dabd33d3193ec2b9aa37bfdde23cf5e6a48c213403fa794deef35e9772c9a"
      },
      {
        "bytes": 9179,
        "mode": "100644",
        "path": "resources/dark-medium-response-atlas/draft-v0.1.0/claim_ledger.csv",
        "sha256": "c6203277139e7a143305575efd766109d3c0aa97146a74ca30e585c7d3c58fe5"
      },
      {
        "bytes": 1316,
        "mode": "100644",
        "path": "resources/dark-medium-response-atlas/draft-v0.1.0/draft_metadata.json",
        "sha256": "cc83ec63888d2a31ca0e6c2ef477801e3fc7cc22f843c5da814078614f3ce8dc"
      },
      {
        "bytes": 2597,
        "mode": "100644",
        "path": "resources/dark-medium-response-atlas/draft-v0.1.0/novelty_ledger.csv",
        "sha256": "0e23c5a790317d8bbe6496d3e64148ecbec6fd7ddc18e51359fba26434b2e383"
      },
      {
        "bytes": 6063,
        "mode": "100644",
        "path": "resources/dark-medium-response-atlas/draft-v0.1.0/source_ledger.csv",
        "sha256": "9978a523975e8a6792232dccb8ec4a19e053637e2531e927d7bacb2eeecb7187"
      }
    ],
    "root": "resources/dark-medium-response-atlas/draft-v0.1.0",
    "roster": [
      "resources/dark-medium-response-atlas/draft-v0.1.0/CHANGE_LOG.md",
      "resources/dark-medium-response-atlas/draft-v0.1.0/DARK_MEDIUM_RESPONSE_ATLAS.md",
      "resources/dark-medium-response-atlas/draft-v0.1.0/LICENSE_MAP.md",
      "resources/dark-medium-response-atlas/draft-v0.1.0/README.md",
      "resources/dark-medium-response-atlas/draft-v0.1.0/claim_ledger.csv",
      "resources/dark-medium-response-atlas/draft-v0.1.0/draft_metadata.json",
      "resources/dark-medium-response-atlas/draft-v0.1.0/novelty_ledger.csv",
      "resources/dark-medium-response-atlas/draft-v0.1.0/source_ledger.csv"
    ],
    "status": "unpromoted_supplemental_research_draft"
  },
  "predecessor_overlay": {
    "authoritative_source_path": "manuscript/manuscript.md",
    "authoritative_source_sha256": "ce55ea375ae5fbc28d06a52e3a2ea6e118294fc2b5925aef99365c39a637c292",
    "inherited_authority": false,
    "path": "evidence/claim_source_coverage_v1.0.7_maintenance_overlay_m1.json",
    "relationship": "immutable_predecessor_not_regenerated_or_superseded",
    "sha256": "a655277bb9f241d8aa28a3ab11eacd03ae097befa5650c02dc50a66385555fd9"
  },
  "prepared_date": "2026-09-01",
  "schema": "https://jkolantree.github.io/astra/schemas/dark-medium-response-atlas-successor-overlay-s1.schema.json",
  "schema_version": "1.0.0",
  "source_projection": {
    "canonical_byte_domain": "git-index-blob",
    "canonical_bytes": 28389,
    "digest_algorithm": "sha256",
    "entries": [
      {
        "bytes": 302,
        "mode": "100644",
        "path": ".gitattributes",
        "sha256": "be74c67c5a56a2895020032909c718ecda670c5391eee17bd3922004c022fdcc"
      },
      {
        "bytes": 2510,
        "mode": "100644",
        "path": ".github/ISSUE_TEMPLATE/accessibility.yml",
        "sha256": "1d60f621710a474590ebc24de60976a3ec3b9d7d63768856e829da41f1909e66"
      },
      {
        "bytes": 441,
        "mode": "100644",
        "path": ".github/ISSUE_TEMPLATE/config.yml",
        "sha256": "d054390fdfad4c853284be6868c954f4f71305d91fa64b37b9539dbd527a3f97"
      },
      {
        "bytes": 2211,
        "mode": "100644",
        "path": ".github/ISSUE_TEMPLATE/reproducibility.yml",
        "sha256": "86cc9be49f3a3eb1b911da37c05910cbe2ce44d8f94bb1b72226ea89ecb23ee2"
      },
      {
        "bytes": 2475,
        "mode": "100644",
        "path": ".github/ISSUE_TEMPLATE/scientific-correction.yml",
        "sha256": "bceec927a44d8be27c43b1b2a54d0b19c73848d29b08366e4921b213f6259bcf"
      },
      {
        "bytes": 24973,
        "mode": "100644",
        "path": ".github/workflows/pages.yml",
        "sha256": "e2f9d34bf394266d55dc6b60d6f599fe58fb4fb151b80a4b3946f189d7896099"
      },
      {
        "bytes": 3165,
        "mode": "100644",
        "path": ".github/workflows/verify.yml",
        "sha256": "fd1444d0c3caaf31e83209b21a8c00808c2f8896de231060cf7c494549dee366"
      },
      {
        "bytes": 120,
        "mode": "100644",
        "path": ".gitignore",
        "sha256": "fca71d6610597facef2f24fe218cd91b8ee516b04ed87bd79eed3dc023fc33c9"
      },
      {
        "bytes": 105,
        "mode": "100644",
        "path": ".mailmap",
        "sha256": "906cda127b9a79e33a6ee6286e7f36689927d065efb3a762964f86e399de09cc"
      },
      {
        "bytes": 8,
        "mode": "100644",
        "path": ".python-version",